{
  "version": 1,
  "title": "Sentry Walker",
  "parts": [
    {
      "id": "body",
      "shape": {
        "type": "box",
        "size": [
          1.2,
          0.7,
          0.9
        ]
      },
      "position": [
        0,
        1.75,
        0
      ],
      "build": {
        "order": 1
      }
    },
    {
      "id": "core",
      "parent": "body",
      "shape": {
        "type": "sphere",
        "radius": 0.18,
        "segments": 8
      },
      "position": [
        0,
        0,
        0.46
      ],
      "intensity": 2.5,
      "build": {
        "order": 5
      }
    },
    {
      "id": "head",
      "parent": "body",
      "shape": {
        "type": "group"
      },
      "position": [
        0,
        0.35,
        0
      ],
      "build": {
        "order": 4
      }
    },
    {
      "id": "visor",
      "parent": "head",
      "shape": {
        "type": "box",
        "size": [
          0.6,
          0.3,
          0.5
        ]
      },
      "position": [
        0,
        0,
        0
      ],
      "offset": [
        0,
        0.15,
        0.05
      ],
      "build": {
        "order": 4
      }
    },
    {
      "id": "eye",
      "parent": "head",
      "shape": {
        "type": "sphere",
        "radius": 0.07,
        "segments": 8
      },
      "position": [
        0,
        0.17,
        0.31
      ],
      "intensity": 3,
      "build": {
        "order": 6
      }
    },
    {
      "id": "antenna",
      "parent": "head",
      "shape": {
        "type": "cylinder",
        "radiusTop": 0.02,
        "radiusBottom": 0.03,
        "height": 0.4
      },
      "position": [
        0.2,
        0.3,
        0
      ],
      "offset": [
        0,
        0.2,
        0
      ],
      "build": {
        "order": 6
      }
    },
    {
      "id": "pack",
      "parent": "body",
      "shape": {
        "type": "box",
        "size": [
          0.6,
          0.5,
          0.3
        ]
      },
      "position": [
        0,
        0.05,
        -0.6
      ],
      "build": {
        "order": 3
      }
    },
    {
      "id": "pod_l",
      "parent": "body",
      "shape": {
        "type": "box",
        "size": [
          0.25,
          0.25,
          0.5
        ]
      },
      "position": [
        0.7200000000000001,
        0.15,
        0
      ],
      "build": {
        "order": 3
      }
    },
    {
      "id": "hip_l",
      "parent": "body",
      "shape": {
        "type": "sphere",
        "radius": 0.14,
        "segments": 8
      },
      "position": [
        0.4,
        -0.35,
        0
      ],
      "build": {
        "order": 2
      }
    },
    {
      "id": "thigh_l",
      "parent": "body",
      "shape": {
        "type": "cylinder",
        "radiusTop": 0.12,
        "radiusBottom": 0.1,
        "height": 0.7
      },
      "position": [
        0.4,
        -0.35,
        0
      ],
      "offset": [
        0,
        -0.35,
        0
      ],
      "build": {
        "order": 2
      }
    },
    {
      "id": "shin_l",
      "parent": "thigh_l",
      "shape": {
        "type": "cylinder",
        "radiusTop": 0.1,
        "radiusBottom": 0.08,
        "height": 0.6
      },
      "position": [
        0,
        -0.7,
        0
      ],
      "offset": [
        0,
        -0.3,
        0
      ],
      "build": {
        "order": 3
      }
    },
    {
      "id": "foot_l",
      "parent": "shin_l",
      "shape": {
        "type": "box",
        "size": [
          0.3,
          0.1,
          0.45
        ]
      },
      "position": [
        0,
        -0.6,
        0.08
      ],
      "offset": [
        0,
        -0.05,
        0
      ],
      "build": {
        "order": 3
      }
    },
    {
      "id": "pod_r",
      "parent": "body",
      "shape": {
        "type": "box",
        "size": [
          0.25,
          0.25,
          0.5
        ]
      },
      "position": [
        -0.7200000000000001,
        0.15,
        0
      ],
      "build": {
        "order": 3
      }
    },
    {
      "id": "hip_r",
      "parent": "body",
      "shape": {
        "type": "sphere",
        "radius": 0.14,
        "segments": 8
      },
      "position": [
        -0.4,
        -0.35,
        0
      ],
      "build": {
        "order": 2
      }
    },
    {
      "id": "thigh_r",
      "parent": "body",
      "shape": {
        "type": "cylinder",
        "radiusTop": 0.12,
        "radiusBottom": 0.1,
        "height": 0.7
      },
      "position": [
        -0.4,
        -0.35,
        0
      ],
      "offset": [
        0,
        -0.35,
        0
      ],
      "build": {
        "order": 2
      }
    },
    {
      "id": "shin_r",
      "parent": "thigh_r",
      "shape": {
        "type": "cylinder",
        "radiusTop": 0.1,
        "radiusBottom": 0.08,
        "height": 0.6
      },
      "position": [
        0,
        -0.7,
        0
      ],
      "offset": [
        0,
        -0.3,
        0
      ],
      "build": {
        "order": 3
      }
    },
    {
      "id": "foot_r",
      "parent": "shin_r",
      "shape": {
        "type": "box",
        "size": [
          0.3,
          0.1,
          0.45
        ]
      },
      "position": [
        0,
        -0.6,
        0.08
      ],
      "offset": [
        0,
        -0.05,
        0
      ],
      "build": {
        "order": 3
      }
    },
    {
      "id": "barrel_l",
      "parent": "pod_l",
      "shape": {
        "type": "cylinder",
        "radiusTop": 0.05,
        "radiusBottom": 0.07,
        "height": 0.4
      },
      "position": [
        0,
        0,
        0.25
      ],
      "rotation": [
        90,
        0,
        0
      ],
      "offset": [
        0,
        0.2,
        0
      ],
      "intensity": 1.5,
      "build": {
        "order": 6
      }
    },
    {
      "id": "barrel_r",
      "parent": "pod_r",
      "shape": {
        "type": "cylinder",
        "radiusTop": 0.05,
        "radiusBottom": 0.07,
        "height": 0.4
      },
      "position": [
        0,
        0,
        0.25
      ],
      "rotation": [
        90,
        0,
        0
      ],
      "offset": [
        0,
        0.2,
        0
      ],
      "intensity": 1.5,
      "build": {
        "order": 6
      }
    },
    {
      "id": "vent",
      "parent": "pack",
      "shape": {
        "type": "torus",
        "radius": 0.12,
        "tube": 0.03
      },
      "position": [
        0,
        0,
        -0.16
      ],
      "build": {
        "order": 6
      }
    }
  ],
  "animations": [
    {
      "part": "head",
      "property": "rotation",
      "duration": 4,
      "loop": "pingpong",
      "keyframes": [
        {
          "t": 0,
          "value": [
            0,
            -25,
            0
          ]
        },
        {
          "t": 1,
          "value": [
            0,
            25,
            0
          ]
        }
      ]
    },
    {
      "part": "thigh_l",
      "property": "rotation",
      "duration": 2,
      "loop": "pingpong",
      "keyframes": [
        {
          "t": 0,
          "value": [
            -15,
            0,
            0
          ]
        },
        {
          "t": 1,
          "value": [
            15,
            0,
            0
          ]
        }
      ]
    },
    {
      "part": "thigh_r",
      "property": "rotation",
      "duration": 2,
      "loop": "pingpong",
      "phase": 0.5,
      "keyframes": [
        {
          "t": 0,
          "value": [
            -15,
            0,
            0
          ]
        },
        {
          "t": 1,
          "value": [
            15,
            0,
            0
          ]
        }
      ]
    },
    {
      "part": "core",
      "property": "scale",
      "duration": 1.5,
      "loop": "pingpong",
      "keyframes": [
        {
          "t": 0,
          "value": [
            1,
            1,
            1
          ]
        },
        {
          "t": 1,
          "value": [
            1.3,
            1.3,
            1.3
          ]
        }
      ]
    },
    {
      "part": "antenna",
      "property": "rotation",
      "duration": 3,
      "loop": "pingpong",
      "keyframes": [
        {
          "t": 0,
          "value": [
            0,
            0,
            -8
          ]
        },
        {
          "t": 1,
          "value": [
            0,
            0,
            8
          ]
        }
      ]
    }
  ],
  "forge": {
    "duration": 5
  }
}