{
  "version": 1,
  "title": "Giant Mech Fist",
  "parts": [
    {
      "id": "base",
      "shape": {
        "type": "cylinder",
        "radiusTop": 1.4,
        "radiusBottom": 1.7,
        "height": 0.4,
        "segments": 8
      },
      "position": [
        0,
        0.2,
        0
      ],
      "build": {
        "order": 0
      }
    },
    {
      "id": "arm",
      "shape": {
        "type": "cylinder",
        "radiusTop": 0.9,
        "radiusBottom": 1.1,
        "height": 2.4,
        "segments": 8
      },
      "position": [
        0,
        1.6,
        0
      ],
      "build": {
        "order": 1
      }
    },
    {
      "id": "arm_ring1",
      "shape": {
        "type": "torus",
        "radius": 1.05,
        "tube": 0.1
      },
      "position": [
        0,
        1,
        0
      ],
      "rotation": [
        90,
        0,
        0
      ],
      "build": {
        "order": 2
      },
      "intensity": 1.8
    },
    {
      "id": "arm_ring2",
      "shape": {
        "type": "torus",
        "radius": 0.95,
        "tube": 0.1
      },
      "position": [
        0,
        2.2,
        0
      ],
      "rotation": [
        90,
        0,
        0
      ],
      "build": {
        "order": 2
      },
      "intensity": 1.8
    },
    {
      "id": "piston_l",
      "shape": {
        "type": "cylinder",
        "radiusTop": 0.12,
        "radiusBottom": 0.12,
        "height": 2.2,
        "segments": 8
      },
      "position": [
        -1.15,
        1.7,
        0
      ],
      "build": {
        "order": 3
      }
    },
    {
      "id": "piston_r",
      "shape": {
        "type": "cylinder",
        "radiusTop": 0.12,
        "radiusBottom": 0.12,
        "height": 2.2,
        "segments": 8
      },
      "position": [
        1.15,
        1.7,
        0
      ],
      "build": {
        "order": 3
      }
    },
    {
      "id": "fist",
      "shape": {
        "type": "group"
      },
      "position": [
        0,
        2.9,
        0
      ]
    },
    {
      "id": "wrist",
      "shape": {
        "type": "sphere",
        "radius": 0.85,
        "segments": 8
      },
      "parent": "fist",
      "position": [
        0,
        0,
        0
      ],
      "build": {
        "order": 4
      },
      "intensity": 1.5
    },
    {
      "id": "palm",
      "shape": {
        "type": "box",
        "size": [
          2.2,
          1.8,
          1.6
        ]
      },
      "parent": "fist",
      "position": [
        0,
        1.1,
        -0.1
      ],
      "build": {
        "order": 5
      }
    },
    {
      "id": "back_plate",
      "shape": {
        "type": "box",
        "size": [
          2.0,
          1.5,
          0.25
        ]
      },
      "parent": "fist",
      "position": [
        0,
        1.15,
        -0.95
      ],
      "build": {
        "order": 6
      }
    },
    {
      "id": "core",
      "shape": {
        "type": "sphere",
        "radius": 0.3,
        "segments": 8
      },
      "parent": "fist",
      "position": [
        0,
        1.15,
        -1.1
      ],
      "build": {
        "order": 9
      },
      "intensity": 3
    },
    {
      "id": "f1",
      "shape": {
        "type": "box",
        "size": [
          0.5,
          0.55,
          0.8
        ]
      },
      "parent": "fist",
      "position": [
        -0.81,
        1.75,
        0.95
      ],
      "build": {
        "order": 7
      }
    },
    {
      "id": "f2",
      "shape": {
        "type": "box",
        "size": [
          0.5,
          0.55,
          0.8
        ]
      },
      "parent": "fist",
      "position": [
        -0.27,
        1.8,
        0.95
      ],
      "build": {
        "order": 7
      }
    },
    {
      "id": "f3",
      "shape": {
        "type": "box",
        "size": [
          0.5,
          0.55,
          0.8
        ]
      },
      "parent": "fist",
      "position": [
        0.27,
        1.8,
        0.95
      ],
      "build": {
        "order": 7
      }
    },
    {
      "id": "f4",
      "shape": {
        "type": "box",
        "size": [
          0.5,
          0.55,
          0.8
        ]
      },
      "parent": "fist",
      "position": [
        0.81,
        1.72,
        0.95
      ],
      "build": {
        "order": 7
      }
    },
    {
      "id": "f1b",
      "shape": {
        "type": "box",
        "size": [
          0.48,
          0.6,
          0.5
        ]
      },
      "parent": "fist",
      "position": [
        -0.81,
        1.15,
        1.2
      ],
      "build": {
        "order": 8
      }
    },
    {
      "id": "f2b",
      "shape": {
        "type": "box",
        "size": [
          0.48,
          0.6,
          0.5
        ]
      },
      "parent": "fist",
      "position": [
        -0.27,
        1.15,
        1.2
      ],
      "build": {
        "order": 8
      }
    },
    {
      "id": "f3b",
      "shape": {
        "type": "box",
        "size": [
          0.48,
          0.6,
          0.5
        ]
      },
      "parent": "fist",
      "position": [
        0.27,
        1.15,
        1.2
      ],
      "build": {
        "order": 8
      }
    },
    {
      "id": "f4b",
      "shape": {
        "type": "box",
        "size": [
          0.48,
          0.6,
          0.5
        ]
      },
      "parent": "fist",
      "position": [
        0.81,
        1.15,
        1.2
      ],
      "build": {
        "order": 8
      }
    },
    {
      "id": "knuckle_bar",
      "shape": {
        "type": "cylinder",
        "radiusTop": 0.14,
        "radiusBottom": 0.14,
        "height": 2.3,
        "segments": 8
      },
      "parent": "fist",
      "position": [
        0,
        1.95,
        1.25
      ],
      "rotation": [
        0,
        0,
        90
      ],
      "build": {
        "order": 9
      },
      "intensity": 2
    },
    {
      "id": "thumb1",
      "shape": {
        "type": "box",
        "size": [
          0.5,
          0.5,
          0.9
        ]
      },
      "parent": "fist",
      "position": [
        1.25,
        0.85,
        0.4
      ],
      "rotation": [
        0,
        -20,
        0
      ],
      "build": {
        "order": 8
      }
    },
    {
      "id": "thumb2",
      "shape": {
        "type": "box",
        "size": [
          0.9,
          0.45,
          0.45
        ]
      },
      "parent": "fist",
      "position": [
        0.75,
        0.75,
        1.1
      ],
      "build": {
        "order": 9
      }
    },
    {
      "id": "spike_l",
      "shape": {
        "type": "cone",
        "radius": 0.15,
        "height": 0.5,
        "segments": 6
      },
      "parent": "fist",
      "position": [
        -0.6,
        2.1,
        -0.6
      ],
      "build": {
        "order": 9
      }
    },
    {
      "id": "spike_r",
      "shape": {
        "type": "cone",
        "radius": 0.15,
        "height": 0.5,
        "segments": 6
      },
      "parent": "fist",
      "position": [
        0.6,
        2.1,
        -0.6
      ],
      "build": {
        "order": 9
      }
    }
  ],
  "animations": [
    {
      "part": "fist",
      "property": "rotation",
      "duration": 4,
      "loop": "pingpong",
      "easing": "sine",
      "keyframes": [
        {
          "t": 0,
          "value": [
            -8,
            -10,
            0
          ]
        },
        {
          "t": 1,
          "value": [
            8,
            10,
            0
          ]
        }
      ]
    },
    {
      "part": "core",
      "property": "scale",
      "duration": 1.5,
      "loop": "pingpong",
      "easing": "sine",
      "keyframes": [
        {
          "t": 0,
          "value": [
            1,
            1,
            1
          ]
        },
        {
          "t": 1,
          "value": [
            1.4,
            1.4,
            1.4
          ]
        }
      ]
    },
    {
      "part": "arm_ring1",
      "property": "rotation",
      "duration": 3,
      "loop": "repeat",
      "easing": "linear",
      "keyframes": [
        {
          "t": 0,
          "value": [
            0,
            0,
            0
          ]
        },
        {
          "t": 1,
          "value": [
            0,
            0,
            360
          ]
        }
      ]
    },
    {
      "part": "arm_ring2",
      "property": "rotation",
      "duration": 3,
      "loop": "repeat",
      "easing": "linear",
      "keyframes": [
        {
          "t": 0,
          "value": [
            0,
            0,
            0
          ]
        },
        {
          "t": 1,
          "value": [
            0,
            0,
            -360
          ]
        }
      ]
    }
  ],
  "forge": {
    "duration": 7
  },
  "id": "20261007-144317_giant-mech-fist",
  "prompt": "a giant mech fist"
}
